{
  "$schema": "http://json-schema.org/draft-07/schema#",
  "$id": "https://tonbankcard.org/schemas/deployment-manifest-v1.json",
  "title": "TONBANKCARD Deployment Manifest",
  "description": "Schema for TONBANKCARD protocol deployment manifests. Each deployment MUST publish a manifest following this schema to ensure traceability and reproducibility.",
  "type": "object",
  "required": [
    "protocolVersion",
    "deployment",
    "source",
    "compiler",
    "contracts"
  ],
  "properties": {
    "$schema": {
      "type": "string",
      "description": "Reference to this schema"
    },
    "protocolVersion": {
      "type": "string",
      "pattern": "^[0-9]+\\.[0-9]+\\.[0-9]+$",
      "description": "Semantic version of the protocol (MAJOR.MINOR.PATCH)"
    },
    "deployment": {
      "type": "object",
      "required": [
        "network",
        "networkId",
        "timestamp",
        "deployer"
      ],
      "properties": {
        "network": {
          "type": "string",
          "enum": [
            "mainnet",
            "testnet",
            "sandbox"
          ],
          "description": "Target network name"
        },
        "networkId": {
          "type": "integer",
          "description": "TON network workchain ID (-1 for masterchain, 0 for basechain, -239 for mainnet global ID)"
        },
        "timestamp": {
          "type": "string",
          "format": "date-time",
          "description": "ISO 8601 timestamp of deployment"
        },
        "deployer": {
          "type": "string",
          "pattern": "^EQ[A-Za-z0-9_-]{46}$|^UQ[A-Za-z0-9_-]{46}$|^-?[0-9]+:[a-fA-F0-9]{64}$",
          "description": "Deployer wallet address (base64 or raw format)"
        },
        "deploymentTxHash": {
          "type": "string",
          "pattern": "^[a-fA-F0-9]{64}$",
          "description": "Transaction hash of deployment (optional)"
        }
      },
      "additionalProperties": false
    },
    "source": {
      "type": "object",
      "required": [
        "repository",
        "commit"
      ],
      "properties": {
        "repository": {
          "type": "string",
          "format": "uri",
          "description": "Git repository URL"
        },
        "commit": {
          "type": "string",
          "pattern": "^[a-fA-F0-9]{40}$",
          "description": "Full 40-character Git commit hash"
        },
        "branch": {
          "type": "string",
          "description": "Git branch name (typically 'main')"
        },
        "tag": {
          "type": "string",
          "pattern": "^v[0-9]+\\.[0-9]+\\.[0-9]+$",
          "description": "Git tag (should match protocolVersion with 'v' prefix)"
        }
      },
      "additionalProperties": false
    },
    "compiler": {
      "type": "object",
      "required": [],
      "properties": {
        "tact": {
          "type": "string",
          "pattern": "^[0-9]+\\.[0-9]+\\.[0-9]+(-[a-zA-Z0-9.]+)?$",
          "description": "Tact compiler version"
        },
        "func": {
          "type": "string",
          "pattern": "^[0-9]+\\.[0-9]+\\.[0-9]+(-[a-zA-Z0-9.]+)?$",
          "description": "FunC compiler version"
        },
        "fift": {
          "type": "string",
          "pattern": "^[0-9]+\\.[0-9]+\\.[0-9]+(-[a-zA-Z0-9.]+)?$",
          "description": "Fift interpreter version"
        },
        "node": {
          "type": "string",
          "pattern": "^[0-9]+\\.[0-9]+\\.[0-9]+$",
          "description": "Node.js version used for build"
        },
        "npm": {
          "type": "string",
          "pattern": "^[0-9]+\\.[0-9]+\\.[0-9]+$",
          "description": "npm version used for build"
        }
      },
      "additionalProperties": true
    },
    "contracts": {
      "type": "array",
      "minItems": 1,
      "items": {
        "type": "object",
        "required": [
          "name",
          "address",
          "codeHash"
        ],
        "properties": {
          "name": {
            "type": "string",
            "description": "Human-readable contract name"
          },
          "address": {
            "type": "string",
            "pattern": "^EQ[A-Za-z0-9_-]{46}$|^UQ[A-Za-z0-9_-]{46}$|^-?[0-9]+:[a-fA-F0-9]{64}$",
            "description": "Deployed contract address"
          },
          "codeHash": {
            "type": "string",
            "pattern": "^sha256:[a-fA-F0-9]{64}$",
            "description": "SHA-256 hash of compiled code cell (prefixed with 'sha256:')"
          },
          "initDataHash": {
            "type": "string",
            "pattern": "^sha256:[a-fA-F0-9]{64}$",
            "description": "SHA-256 hash of initial data cell (optional)"
          },
          "sourceFile": {
            "type": "string",
            "description": "Path to source file relative to repository root"
          },
          "invariants": {
            "type": "array",
            "items": {
              "type": "string",
              "enum": [
                "I1-non-custodial",
                "I2-nft-authority",
                "I3-no-admin-control",
                "I4-atomic-transfers",
                "I5-ledger-conservation",
                "I6-lock-not-confiscation",
                "I7-adapter-isolation"
              ]
            },
            "description": "List of protocol invariants this contract implements"
          }
        },
        "additionalProperties": false
      },
      "description": "Array of deployed contracts"
    },
    "verification": {
      "type": "object",
      "properties": {
        "bytecodeVerified": {
          "type": "boolean",
          "description": "Whether bytecode has been independently verified"
        },
        "sourceAvailable": {
          "type": "boolean",
          "description": "Whether source code is publicly available"
        },
        "auditReports": {
          "type": "array",
          "items": {
            "type": "string",
            "format": "uri"
          },
          "description": "URLs to security audit reports"
        },
        "verificationTools": {
          "type": "array",
          "items": {
            "type": "string"
          },
          "description": "Tools used for bytecode verification (e.g., 'ton-verifier', 'tonscan')"
        }
      },
      "additionalProperties": false
    },
    "immutability": {
      "type": "object",
      "properties": {
        "upgradeProhibited": {
          "type": "boolean",
          "const": true,
          "description": "MUST be true - confirms no upgrade mechanisms exist"
        },
        "noProxyPatterns": {
          "type": "boolean",
          "const": true,
          "description": "MUST be true - confirms no proxy/delegatecall patterns"
        },
        "noAdminControl": {
          "type": "boolean",
          "const": true,
          "description": "MUST be true - confirms no admin fund control"
        },
        "noSelfDestruct": {
          "type": "boolean",
          "const": true,
          "description": "MUST be true - confirms no self-destruct capability"
        }
      },
      "additionalProperties": false,
      "description": "Immutability guarantees - all values MUST be true"
    },
    "dependencies": {
      "type": "array",
      "items": {
        "type": "object",
        "required": [
          "name",
          "address"
        ],
        "properties": {
          "name": {
            "type": "string",
            "description": "Dependency contract name"
          },
          "address": {
            "type": "string",
            "description": "Dependency contract address"
          },
          "version": {
            "type": "string",
            "description": "Dependency protocol version"
          }
        },
        "additionalProperties": false
      },
      "description": "External contract dependencies (e.g., NFT collections, DEX pools)"
    },
    "notes": {
      "type": "string",
      "description": "Optional deployment notes or comments"
    }
  },
  "additionalProperties": false
}
